{
  "$schema": "https://json-schema.org/draft/2020-12/schema",
  "title": "r06-idiom-literal — literal-translation joke, then the real meaning",
  "type": "object",
  "additionalProperties": false,
  "required": ["label", "idiom", "literal_tr", "emojis", "meaning_tr", "meaning_en", "example", "cta", "meta"],
  "properties": {
    "label": { "type": "string", "minLength": 4, "maxLength": 24 },
    "idiom": { "type": "string", "minLength": 6, "maxLength": 34, "description": "The English idiom" },
    "literal_tr": { "type": "string", "minLength": 6, "maxLength": 40, "description": "Absurd word-for-word Turkish translation, ends with ?! or 😅" },
    "emojis": { "type": "string", "minLength": 2, "maxLength": 20, "description": "2–4 emojis illustrating the literal meaning, no spaces" },
    "meaning_tr": { "type": "string", "minLength": 6, "maxLength": 56, "description": "Real meaning as a natural Turkish phrase/idiom" },
    "meaning_en": { "type": "string", "minLength": 6, "maxLength": 60 },
    "example": { "type": "string", "minLength": 15, "maxLength": 80, "pattern": "==.+==", "description": "Example sentence with the idiom wrapped in ==double equals==" },
    "cta": { "type": "string", "minLength": 6, "maxLength": 44 },
    "meta": { "$ref": "../_shared/meta.schema.json" }
  }
}
