{
  "label": "Idiom of the day",
  "idiom": "It's raining cats and dogs",
  "literal_tr": "Kedi köpek yağıyor?!",
  "emojis": "🌧️🐱🐶",
  "meaning_tr": "Bardaktan boşanırcasına yağmur yağıyor",
  "meaning_en": "It's raining very heavily.",
  "example": "Take an umbrella — ==it's raining cats and dogs== out there!",
  "cta": "Kaydet 🔖 En garip deyim hangisi? Yorumla",
  "meta": {
    "topic": "raining cats and dogs",
    "caption": "Kedi köpek mi yağıyor? 🐱🐶🌧️\n\n\"It's raining cats and dogs\" = bardaktan boşanırcasına yağmur yağıyor. Hayvanlarla alakası yok 😄\n\nÖrnek: Take an umbrella — it's raining cats and dogs out there!\n\nİngilizcede sana en garip gelen deyim hangisi? Yorumlara yaz 👇\nKaydet, deyim listene ekle 🔖\n\nIdiom of the day: raining cats and dogs = raining very heavily.",
    "hashtags": ["#ingilizcedeyimler", "#idioms", "#ahkakademi", "#ingilizce", "#learnenglish", "#englishidioms", "#ingilizceöğreniyorum", "#ielts", "#speakenglish", "#vocabulary", "#funnyenglish"],
    "audio_mood": "comedic suspense, record-scratch before the reveal"
  }
}
